{
  "format": "fwcollab.symbolic.state_dag.v1",
  "id": "DAG-L3-008",
  "difficulty": "L3",
  "evaluation_role": "scored",
  "visibility": "private_reference",
  "title": "箱子遮光门 × 角色压板桥 × 可推箱子",
  "summary": "以fan_out拓扑组合3种元机关：箱子遮光门 × 角色压板桥 × 可推箱子。",
  "topology_family": "fan_out",
  "mechanisms": [
    "M22",
    "M14",
    "M06"
  ],
  "nodes": [
    {
      "id": "n000",
      "kind": "condition",
      "owner": "team",
      "join": "all",
      "predicate": {
        "op": "start",
        "motif": "SYSTEM",
        "state": "task_ready",
        "phase": 0
      },
      "label": "任务初始状态成立"
    },
    {
      "id": "n001",
      "kind": "event",
      "owner": "agent_a",
      "join": "all",
      "predicate": {
        "op": "position",
        "motif": "M22",
        "state": "crate_beam_state",
        "phase": 0
      },
      "label": "箱子到达目标遮光位置"
    },
    {
      "id": "n002",
      "kind": "state",
      "owner": "environment",
      "join": "all",
      "predicate": {
        "op": "sense",
        "motif": "M22",
        "state": "sensor_desired",
        "phase": 0
      },
      "label": "传感器达到目标状态"
    },
    {
      "id": "n003",
      "kind": "state",
      "owner": "environment",
      "join": "all",
      "predicate": {
        "op": "activate",
        "motif": "M22",
        "state": "door_desired_state",
        "phase": 0
      },
      "label": "遮光门状态正确"
    },
    {
      "id": "n004",
      "kind": "event",
      "owner": "agent_b",
      "join": "all",
      "predicate": {
        "op": "traverse",
        "motif": "M22",
        "state": "partner_crossed_door",
        "phase": 0
      },
      "label": "搭档通过遮光门"
    },
    {
      "id": "n005",
      "kind": "condition",
      "owner": "agent_b",
      "join": "all",
      "predicate": {
        "op": "occupy",
        "motif": "M14",
        "state": "plate_held",
        "phase": 1
      },
      "label": "角色持续占据桥压力板"
    },
    {
      "id": "n006",
      "kind": "state",
      "owner": "environment",
      "join": "all",
      "predicate": {
        "op": "activate",
        "motif": "M14",
        "state": "bridge_deployed",
        "phase": 1
      },
      "label": "压力板桥保持展开"
    },
    {
      "id": "n007",
      "kind": "event",
      "owner": "agent_a",
      "join": "all",
      "predicate": {
        "op": "traverse",
        "motif": "M14",
        "state": "partner_crossed_bridge",
        "phase": 1
      },
      "label": "搭档通过压力板桥"
    },
    {
      "id": "n008",
      "kind": "condition",
      "owner": "agent_a",
      "join": "all",
      "predicate": {
        "op": "reach",
        "motif": "M06",
        "state": "crate_reachable",
        "phase": 2
      },
      "label": "角色到达箱子推动位"
    },
    {
      "id": "n009",
      "kind": "event",
      "owner": "agent_a",
      "join": "all",
      "predicate": {
        "op": "position",
        "motif": "M06",
        "state": "crate_positioned",
        "phase": 2
      },
      "label": "箱子到达目标位置"
    },
    {
      "id": "n010",
      "kind": "goal",
      "owner": "team",
      "join": "all",
      "predicate": {
        "op": "team_success",
        "motif": "SYSTEM",
        "state": "all_required_goals",
        "phase": 4
      },
      "label": "双方满足团队成功条件"
    }
  ],
  "edges": [
    {
      "from": "n001",
      "to": "n002",
      "relation": "enables"
    },
    {
      "from": "n002",
      "to": "n003",
      "relation": "enables"
    },
    {
      "from": "n003",
      "to": "n004",
      "relation": "enables"
    },
    {
      "from": "n001",
      "to": "n004",
      "relation": "handoff"
    },
    {
      "from": "n005",
      "to": "n006",
      "relation": "enables"
    },
    {
      "from": "n006",
      "to": "n007",
      "relation": "enables"
    },
    {
      "from": "n005",
      "to": "n007",
      "relation": "maintains"
    },
    {
      "from": "n008",
      "to": "n009",
      "relation": "enables"
    },
    {
      "from": "n004",
      "to": "n005",
      "relation": "requires"
    },
    {
      "from": "n004",
      "to": "n008",
      "relation": "handoff"
    },
    {
      "from": "n000",
      "to": "n001",
      "relation": "requires"
    },
    {
      "from": "n007",
      "to": "n010",
      "relation": "synchronizes"
    },
    {
      "from": "n009",
      "to": "n010",
      "relation": "synchronizes"
    }
  ]
}
