{
  "format": "fwcollab.symbolic.state_dag.v1",
  "id": "DAG-HG-008",
  "difficulty": "L5",
  "evaluation_role": "diagnostic",
  "visibility": "private_reference",
  "title": "held-out layout paired with V4-L5-004",
  "summary": "DAG derived from concrete v3 controller wiring.",
  "topology_family": "constructive_controller_module",
  "mechanisms": [
    "M06",
    "M14",
    "M17",
    "M18",
    "M19",
    "M20"
  ],
  "nodes": [
    {
      "id": "n000",
      "kind": "condition",
      "owner": "team",
      "join": "all",
      "predicate": {
        "op": "start",
        "motif": "SYSTEM",
        "state": "task_ready",
        "phase": 0
      },
      "label": "start:task_ready"
    },
    {
      "id": "n001",
      "kind": "event",
      "owner": "agent_b",
      "join": "all",
      "predicate": {
        "op": "latch",
        "motif": "M17",
        "state": "c1_lever_on",
        "phase": 1
      },
      "label": "latch:c1_lever_on"
    },
    {
      "id": "n002",
      "kind": "event",
      "owner": "agent_b",
      "join": "all",
      "predicate": {
        "op": "latch",
        "motif": "M17",
        "state": "c2_lever_on",
        "phase": 2
      },
      "label": "latch:c2_lever_on"
    },
    {
      "id": "n003",
      "kind": "state",
      "owner": "environment",
      "join": "any",
      "predicate": {
        "op": "activate",
        "motif": "M17",
        "state": "a1_door_on",
        "phase": 3
      },
      "label": "activate:a1_door_on"
    },
    {
      "id": "n004",
      "kind": "event",
      "owner": "agent_a",
      "join": "all",
      "predicate": {
        "op": "traverse",
        "motif": "M17",
        "state": "a1_door_crossed",
        "phase": 4
      },
      "label": "traverse:a1_door_crossed"
    },
    {
      "id": "n005",
      "kind": "condition",
      "owner": "agent_a",
      "join": "all",
      "predicate": {
        "op": "occupy",
        "motif": "M14",
        "state": "c3_plate_on",
        "phase": 5
      },
      "label": "occupy:c3_plate_on"
    },
    {
      "id": "n006",
      "kind": "state",
      "owner": "environment",
      "join": "all",
      "predicate": {
        "op": "activate",
        "motif": "M14",
        "state": "a2_platform_on",
        "phase": 6
      },
      "label": "activate:a2_platform_on"
    },
    {
      "id": "n007",
      "kind": "event",
      "owner": "agent_b",
      "join": "all",
      "predicate": {
        "op": "traverse",
        "motif": "M14",
        "state": "a2_platform_crossed",
        "phase": 7
      },
      "label": "traverse:a2_platform_crossed"
    },
    {
      "id": "n008",
      "kind": "event",
      "owner": "agent_b",
      "join": "all",
      "predicate": {
        "op": "latch",
        "motif": "M18",
        "state": "c4_lever_on",
        "phase": 8
      },
      "label": "latch:c4_lever_on"
    },
    {
      "id": "n009",
      "kind": "state",
      "owner": "environment",
      "join": "all",
      "predicate": {
        "op": "activate",
        "motif": "M18",
        "state": "a3_platform_on",
        "phase": 9
      },
      "label": "activate:a3_platform_on"
    },
    {
      "id": "n010",
      "kind": "event",
      "owner": "agent_a",
      "join": "all",
      "predicate": {
        "op": "traverse",
        "motif": "M18",
        "state": "a3_platform_crossed",
        "phase": 10
      },
      "label": "traverse:a3_platform_crossed"
    },
    {
      "id": "n011",
      "kind": "event",
      "owner": "agent_a",
      "join": "all",
      "predicate": {
        "op": "toggle",
        "motif": "M19",
        "state": "c5_toggle_on",
        "phase": 11
      },
      "label": "toggle:c5_toggle_on"
    },
    {
      "id": "n012",
      "kind": "state",
      "owner": "environment",
      "join": "all",
      "predicate": {
        "op": "activate",
        "motif": "M19",
        "state": "a4_door_on",
        "phase": 12
      },
      "label": "activate:a4_door_on"
    },
    {
      "id": "n013",
      "kind": "event",
      "owner": "agent_b",
      "join": "all",
      "predicate": {
        "op": "traverse",
        "motif": "M19",
        "state": "a4_door_crossed",
        "phase": 13
      },
      "label": "traverse:a4_door_crossed"
    },
    {
      "id": "n014",
      "kind": "event",
      "owner": "agent_b",
      "join": "all",
      "predicate": {
        "op": "toggle",
        "motif": "M20",
        "state": "c6_toggle_on",
        "phase": 14
      },
      "label": "toggle:c6_toggle_on"
    },
    {
      "id": "n015",
      "kind": "state",
      "owner": "environment",
      "join": "all",
      "predicate": {
        "op": "activate",
        "motif": "M20",
        "state": "a5_platform_on",
        "phase": 15
      },
      "label": "activate:a5_platform_on"
    },
    {
      "id": "n016",
      "kind": "event",
      "owner": "agent_a",
      "join": "all",
      "predicate": {
        "op": "traverse",
        "motif": "M20",
        "state": "a5_platform_crossed",
        "phase": 16
      },
      "label": "traverse:a5_platform_crossed"
    },
    {
      "id": "n017",
      "kind": "goal",
      "owner": "team",
      "join": "all",
      "predicate": {
        "op": "team_success",
        "motif": "SYSTEM",
        "state": "all_required_goals",
        "phase": 17
      },
      "label": "team_success:all_required_goals"
    },
    {
      "id": "n018",
      "kind": "state",
      "owner": "environment",
      "join": "all",
      "predicate": {
        "op": "engage",
        "motif": "M06",
        "state": "m06_engaged",
        "phase": 18
      },
      "label": "engage:mandatory crate displacement"
    },
    {
      "id": "n019",
      "kind": "event",
      "owner": "agent_a",
      "join": "all",
      "predicate": {
        "op": "traverse",
        "motif": "M06",
        "state": "m06_crossed",
        "phase": 19
      },
      "label": "traverse:mandatory crate displacement"
    }
  ],
  "edges": [
    {
      "from": "n000",
      "to": "n001",
      "relation": "requires"
    },
    {
      "from": "n000",
      "to": "n002",
      "relation": "requires"
    },
    {
      "from": "n001",
      "to": "n003",
      "relation": "enables"
    },
    {
      "from": "n002",
      "to": "n003",
      "relation": "enables"
    },
    {
      "from": "n003",
      "to": "n004",
      "relation": "enables"
    },
    {
      "from": "n004",
      "to": "n005",
      "relation": "requires"
    },
    {
      "from": "n005",
      "to": "n006",
      "relation": "enables"
    },
    {
      "from": "n006",
      "to": "n007",
      "relation": "enables"
    },
    {
      "from": "n007",
      "to": "n008",
      "relation": "requires"
    },
    {
      "from": "n008",
      "to": "n009",
      "relation": "enables"
    },
    {
      "from": "n009",
      "to": "n010",
      "relation": "enables"
    },
    {
      "from": "n010",
      "to": "n011",
      "relation": "requires"
    },
    {
      "from": "n011",
      "to": "n012",
      "relation": "enables"
    },
    {
      "from": "n012",
      "to": "n013",
      "relation": "enables"
    },
    {
      "from": "n013",
      "to": "n014",
      "relation": "requires"
    },
    {
      "from": "n014",
      "to": "n015",
      "relation": "enables"
    },
    {
      "from": "n015",
      "to": "n016",
      "relation": "enables"
    },
    {
      "from": "n016",
      "to": "n018",
      "relation": "requires"
    },
    {
      "from": "n018",
      "to": "n019",
      "relation": "enables"
    },
    {
      "from": "n019",
      "to": "n017",
      "relation": "synchronizes"
    }
  ]
}
