{
  "format": "fwcollab.symbolic.state_dag.v1",
  "id": "DAG-L4-013",
  "difficulty": "L4",
  "evaluation_role": "scored",
  "visibility": "private_reference",
  "title": "固定反射机关球遮光门 × 机关球遮光门 × 二态切换桥 × 持久拨杆门 × 角色压板桥",
  "summary": "以ladder拓扑组合5种元机关：固定反射机关球遮光门 × 机关球遮光门 × 二态切换桥 × 持久拨杆门 × 角色压板桥。",
  "topology_family": "ladder",
  "mechanisms": [
    "M26",
    "M23",
    "M20",
    "M17",
    "M14"
  ],
  "nodes": [
    {
      "id": "n000",
      "kind": "condition",
      "owner": "team",
      "join": "all",
      "predicate": {
        "op": "start",
        "motif": "SYSTEM",
        "state": "task_ready",
        "phase": 0
      },
      "label": "任务初始状态成立"
    },
    {
      "id": "n001",
      "kind": "event",
      "owner": "agent_a",
      "join": "all",
      "predicate": {
        "op": "position",
        "motif": "M26",
        "state": "orb_reflection_state",
        "phase": 0
      },
      "label": "机关球对齐反射光路"
    },
    {
      "id": "n002",
      "kind": "state",
      "owner": "environment",
      "join": "all",
      "predicate": {
        "op": "route",
        "motif": "M26",
        "state": "fixed_reflection_desired",
        "phase": 0
      },
      "label": "固定反射光路达到目标状态"
    },
    {
      "id": "n003",
      "kind": "state",
      "owner": "environment",
      "join": "all",
      "predicate": {
        "op": "sense",
        "motif": "M26",
        "state": "sensor_desired",
        "phase": 0
      },
      "label": "反射传感器状态正确"
    },
    {
      "id": "n004",
      "kind": "state",
      "owner": "environment",
      "join": "all",
      "predicate": {
        "op": "activate",
        "motif": "M26",
        "state": "door_desired_state",
        "phase": 0
      },
      "label": "反射遮光门状态正确"
    },
    {
      "id": "n005",
      "kind": "event",
      "owner": "agent_b",
      "join": "all",
      "predicate": {
        "op": "traverse",
        "motif": "M26",
        "state": "partner_crossed_door",
        "phase": 0
      },
      "label": "搭档通过反射遮光门"
    },
    {
      "id": "n006",
      "kind": "event",
      "owner": "agent_b",
      "join": "all",
      "predicate": {
        "op": "position",
        "motif": "M23",
        "state": "orb_beam_state",
        "phase": 1
      },
      "label": "机关球停在目标遮光位置"
    },
    {
      "id": "n007",
      "kind": "state",
      "owner": "environment",
      "join": "all",
      "predicate": {
        "op": "sense",
        "motif": "M23",
        "state": "sensor_desired",
        "phase": 1
      },
      "label": "传感器达到目标状态"
    },
    {
      "id": "n008",
      "kind": "state",
      "owner": "environment",
      "join": "all",
      "predicate": {
        "op": "activate",
        "motif": "M23",
        "state": "door_desired_state",
        "phase": 1
      },
      "label": "遮光门状态正确"
    },
    {
      "id": "n009",
      "kind": "event",
      "owner": "agent_a",
      "join": "all",
      "predicate": {
        "op": "traverse",
        "motif": "M23",
        "state": "partner_crossed_door",
        "phase": 1
      },
      "label": "搭档通过遮光门"
    },
    {
      "id": "n010",
      "kind": "event",
      "owner": "agent_a",
      "join": "all",
      "predicate": {
        "op": "toggle",
        "motif": "M20",
        "state": "toggle_desired",
        "phase": 2
      },
      "label": "桥切换器进入目标状态"
    },
    {
      "id": "n011",
      "kind": "state",
      "owner": "environment",
      "join": "all",
      "predicate": {
        "op": "activate",
        "motif": "M20",
        "state": "bridge_desired_state",
        "phase": 2
      },
      "label": "切换桥状态正确"
    },
    {
      "id": "n012",
      "kind": "event",
      "owner": "agent_b",
      "join": "all",
      "predicate": {
        "op": "traverse",
        "motif": "M20",
        "state": "partner_crossed_bridge",
        "phase": 2
      },
      "label": "搭档通过切换桥"
    },
    {
      "id": "n013",
      "kind": "event",
      "owner": "agent_b",
      "join": "all",
      "predicate": {
        "op": "reach",
        "motif": "M17",
        "state": "lever_reached",
        "phase": 3
      },
      "label": "角色到达持久拨杆"
    },
    {
      "id": "n014",
      "kind": "state",
      "owner": "environment",
      "join": "all",
      "predicate": {
        "op": "latch",
        "motif": "M17",
        "state": "door_latched_open",
        "phase": 3
      },
      "label": "拨杆门永久打开"
    },
    {
      "id": "n015",
      "kind": "event",
      "owner": "agent_a",
      "join": "all",
      "predicate": {
        "op": "traverse",
        "motif": "M17",
        "state": "partner_crossed_door",
        "phase": 3
      },
      "label": "搭档通过拨杆门"
    },
    {
      "id": "n016",
      "kind": "condition",
      "owner": "agent_a",
      "join": "all",
      "predicate": {
        "op": "occupy",
        "motif": "M14",
        "state": "plate_held",
        "phase": 4
      },
      "label": "角色持续占据桥压力板"
    },
    {
      "id": "n017",
      "kind": "state",
      "owner": "environment",
      "join": "all",
      "predicate": {
        "op": "activate",
        "motif": "M14",
        "state": "bridge_deployed",
        "phase": 4
      },
      "label": "压力板桥保持展开"
    },
    {
      "id": "n018",
      "kind": "event",
      "owner": "agent_b",
      "join": "all",
      "predicate": {
        "op": "traverse",
        "motif": "M14",
        "state": "partner_crossed_bridge",
        "phase": 4
      },
      "label": "搭档通过压力板桥"
    },
    {
      "id": "n019",
      "kind": "goal",
      "owner": "team",
      "join": "all",
      "predicate": {
        "op": "team_success",
        "motif": "SYSTEM",
        "state": "all_required_goals",
        "phase": 6
      },
      "label": "双方满足团队成功条件"
    }
  ],
  "edges": [
    {
      "from": "n001",
      "to": "n002",
      "relation": "enables"
    },
    {
      "from": "n002",
      "to": "n003",
      "relation": "enables"
    },
    {
      "from": "n003",
      "to": "n004",
      "relation": "enables"
    },
    {
      "from": "n004",
      "to": "n005",
      "relation": "enables"
    },
    {
      "from": "n001",
      "to": "n005",
      "relation": "handoff"
    },
    {
      "from": "n006",
      "to": "n007",
      "relation": "enables"
    },
    {
      "from": "n007",
      "to": "n008",
      "relation": "enables"
    },
    {
      "from": "n008",
      "to": "n009",
      "relation": "enables"
    },
    {
      "from": "n006",
      "to": "n009",
      "relation": "handoff"
    },
    {
      "from": "n010",
      "to": "n011",
      "relation": "enables"
    },
    {
      "from": "n011",
      "to": "n012",
      "relation": "enables"
    },
    {
      "from": "n010",
      "to": "n012",
      "relation": "handoff"
    },
    {
      "from": "n013",
      "to": "n014",
      "relation": "enables"
    },
    {
      "from": "n014",
      "to": "n015",
      "relation": "enables"
    },
    {
      "from": "n013",
      "to": "n015",
      "relation": "handoff"
    },
    {
      "from": "n016",
      "to": "n017",
      "relation": "enables"
    },
    {
      "from": "n017",
      "to": "n018",
      "relation": "enables"
    },
    {
      "from": "n016",
      "to": "n018",
      "relation": "maintains"
    },
    {
      "from": "n005",
      "to": "n010",
      "relation": "handoff"
    },
    {
      "from": "n012",
      "to": "n016",
      "relation": "handoff"
    },
    {
      "from": "n009",
      "to": "n013",
      "relation": "handoff"
    },
    {
      "from": "n005",
      "to": "n013",
      "relation": "handoff"
    },
    {
      "from": "n000",
      "to": "n001",
      "relation": "requires"
    },
    {
      "from": "n000",
      "to": "n006",
      "relation": "requires"
    },
    {
      "from": "n015",
      "to": "n019",
      "relation": "synchronizes"
    },
    {
      "from": "n018",
      "to": "n019",
      "relation": "synchronizes"
    }
  ]
}
