{
  "format": "fwcollab.symbolic.state_dag.v1",
  "id": "DAG-L5-018",
  "difficulty": "L5",
  "evaluation_role": "scored",
  "visibility": "private_reference",
  "title": "机关球压板门 × 固定反射箱子遮光门 × 箱子压板门 × 固定反射光感门 × 角色压板门 × 机关球遮光门",
  "summary": "以two_wave拓扑组合6种元机关：机关球压板门 × 固定反射箱子遮光门 × 箱子压板门 × 固定反射光感门 × 角色压板门 × 机关球遮光门。",
  "topology_family": "two_wave",
  "mechanisms": [
    "M13",
    "M25",
    "M12",
    "M24",
    "M11",
    "M23"
  ],
  "nodes": [
    {
      "id": "n000",
      "kind": "condition",
      "owner": "team",
      "join": "all",
      "predicate": {
        "op": "start",
        "motif": "SYSTEM",
        "state": "task_ready",
        "phase": 0
      },
      "label": "任务初始状态成立"
    },
    {
      "id": "n001",
      "kind": "event",
      "owner": "agent_a",
      "join": "all",
      "predicate": {
        "op": "position",
        "motif": "M13",
        "state": "orb_on_plate",
        "phase": 0
      },
      "label": "机关球停在压力板"
    },
    {
      "id": "n002",
      "kind": "state",
      "owner": "environment",
      "join": "all",
      "predicate": {
        "op": "activate",
        "motif": "M13",
        "state": "door_open",
        "phase": 0
      },
      "label": "机关球压力板门打开"
    },
    {
      "id": "n003",
      "kind": "event",
      "owner": "team",
      "join": "all",
      "predicate": {
        "op": "traverse",
        "motif": "M13",
        "state": "team_crossed_door",
        "phase": 0
      },
      "label": "所需角色通过机关球门"
    },
    {
      "id": "n004",
      "kind": "event",
      "owner": "agent_b",
      "join": "all",
      "predicate": {
        "op": "position",
        "motif": "M25",
        "state": "crate_reflection_state",
        "phase": 1
      },
      "label": "箱子对齐反射光路"
    },
    {
      "id": "n005",
      "kind": "state",
      "owner": "environment",
      "join": "all",
      "predicate": {
        "op": "route",
        "motif": "M25",
        "state": "fixed_reflection_desired",
        "phase": 1
      },
      "label": "固定反射光路达到目标状态"
    },
    {
      "id": "n006",
      "kind": "state",
      "owner": "environment",
      "join": "all",
      "predicate": {
        "op": "sense",
        "motif": "M25",
        "state": "sensor_desired",
        "phase": 1
      },
      "label": "反射传感器状态正确"
    },
    {
      "id": "n007",
      "kind": "state",
      "owner": "environment",
      "join": "all",
      "predicate": {
        "op": "activate",
        "motif": "M25",
        "state": "door_desired_state",
        "phase": 1
      },
      "label": "反射遮光门状态正确"
    },
    {
      "id": "n008",
      "kind": "event",
      "owner": "agent_a",
      "join": "all",
      "predicate": {
        "op": "traverse",
        "motif": "M25",
        "state": "partner_crossed_door",
        "phase": 1
      },
      "label": "搭档通过反射遮光门"
    },
    {
      "id": "n009",
      "kind": "event",
      "owner": "agent_a",
      "join": "all",
      "predicate": {
        "op": "position",
        "motif": "M12",
        "state": "crate_on_plate",
        "phase": 2
      },
      "label": "箱子到达压力板"
    },
    {
      "id": "n010",
      "kind": "state",
      "owner": "environment",
      "join": "all",
      "predicate": {
        "op": "activate",
        "motif": "M12",
        "state": "door_open",
        "phase": 2
      },
      "label": "箱子压力板门打开"
    },
    {
      "id": "n011",
      "kind": "event",
      "owner": "team",
      "join": "all",
      "predicate": {
        "op": "traverse",
        "motif": "M12",
        "state": "team_crossed_door",
        "phase": 2
      },
      "label": "所需角色通过箱子门"
    },
    {
      "id": "n012",
      "kind": "condition",
      "owner": "environment",
      "join": "all",
      "predicate": {
        "op": "route",
        "motif": "M24",
        "state": "fixed_reflection_aligned",
        "phase": 3
      },
      "label": "固定镜面光路成立"
    },
    {
      "id": "n013",
      "kind": "state",
      "owner": "environment",
      "join": "all",
      "predicate": {
        "op": "sense",
        "motif": "M24",
        "state": "sensor_lit",
        "phase": 3
      },
      "label": "反射光点亮传感器"
    },
    {
      "id": "n014",
      "kind": "state",
      "owner": "environment",
      "join": "all",
      "predicate": {
        "op": "activate",
        "motif": "M24",
        "state": "door_open",
        "phase": 3
      },
      "label": "反射光感门打开"
    },
    {
      "id": "n015",
      "kind": "event",
      "owner": "agent_b",
      "join": "all",
      "predicate": {
        "op": "traverse",
        "motif": "M24",
        "state": "agent_crossed_door",
        "phase": 3
      },
      "label": "角色通过反射光感门"
    },
    {
      "id": "n016",
      "kind": "condition",
      "owner": "agent_a",
      "join": "all",
      "predicate": {
        "op": "occupy",
        "motif": "M11",
        "state": "plate_held",
        "phase": 4
      },
      "label": "角色持续占据压力板"
    },
    {
      "id": "n017",
      "kind": "state",
      "owner": "environment",
      "join": "all",
      "predicate": {
        "op": "activate",
        "motif": "M11",
        "state": "door_open",
        "phase": 4
      },
      "label": "压力板门保持打开"
    },
    {
      "id": "n018",
      "kind": "event",
      "owner": "agent_b",
      "join": "all",
      "predicate": {
        "op": "traverse",
        "motif": "M11",
        "state": "partner_crossed_door",
        "phase": 4
      },
      "label": "搭档通过压力板门"
    },
    {
      "id": "n019",
      "kind": "event",
      "owner": "agent_b",
      "join": "all",
      "predicate": {
        "op": "position",
        "motif": "M23",
        "state": "orb_beam_state",
        "phase": 5
      },
      "label": "机关球停在目标遮光位置"
    },
    {
      "id": "n020",
      "kind": "state",
      "owner": "environment",
      "join": "all",
      "predicate": {
        "op": "sense",
        "motif": "M23",
        "state": "sensor_desired",
        "phase": 5
      },
      "label": "传感器达到目标状态"
    },
    {
      "id": "n021",
      "kind": "state",
      "owner": "environment",
      "join": "all",
      "predicate": {
        "op": "activate",
        "motif": "M23",
        "state": "door_desired_state",
        "phase": 5
      },
      "label": "遮光门状态正确"
    },
    {
      "id": "n022",
      "kind": "event",
      "owner": "agent_a",
      "join": "all",
      "predicate": {
        "op": "traverse",
        "motif": "M23",
        "state": "partner_crossed_door",
        "phase": 5
      },
      "label": "搭档通过遮光门"
    },
    {
      "id": "n023",
      "kind": "state",
      "owner": "team",
      "join": "all",
      "predicate": {
        "op": "synchronize",
        "motif": "SYSTEM",
        "state": "wave_one",
        "phase": 6
      },
      "label": "第一批并行子目标完成"
    },
    {
      "id": "n024",
      "kind": "goal",
      "owner": "team",
      "join": "all",
      "predicate": {
        "op": "team_success",
        "motif": "SYSTEM",
        "state": "all_required_goals",
        "phase": 7
      },
      "label": "双方满足团队成功条件"
    }
  ],
  "edges": [
    {
      "from": "n001",
      "to": "n002",
      "relation": "enables"
    },
    {
      "from": "n002",
      "to": "n003",
      "relation": "enables"
    },
    {
      "from": "n004",
      "to": "n005",
      "relation": "enables"
    },
    {
      "from": "n005",
      "to": "n006",
      "relation": "enables"
    },
    {
      "from": "n006",
      "to": "n007",
      "relation": "enables"
    },
    {
      "from": "n007",
      "to": "n008",
      "relation": "enables"
    },
    {
      "from": "n004",
      "to": "n008",
      "relation": "handoff"
    },
    {
      "from": "n009",
      "to": "n010",
      "relation": "enables"
    },
    {
      "from": "n010",
      "to": "n011",
      "relation": "enables"
    },
    {
      "from": "n012",
      "to": "n013",
      "relation": "enables"
    },
    {
      "from": "n013",
      "to": "n014",
      "relation": "enables"
    },
    {
      "from": "n014",
      "to": "n015",
      "relation": "enables"
    },
    {
      "from": "n016",
      "to": "n017",
      "relation": "enables"
    },
    {
      "from": "n017",
      "to": "n018",
      "relation": "enables"
    },
    {
      "from": "n016",
      "to": "n018",
      "relation": "maintains"
    },
    {
      "from": "n019",
      "to": "n020",
      "relation": "enables"
    },
    {
      "from": "n020",
      "to": "n021",
      "relation": "enables"
    },
    {
      "from": "n021",
      "to": "n022",
      "relation": "enables"
    },
    {
      "from": "n019",
      "to": "n022",
      "relation": "handoff"
    },
    {
      "from": "n003",
      "to": "n023",
      "relation": "synchronizes"
    },
    {
      "from": "n008",
      "to": "n023",
      "relation": "synchronizes"
    },
    {
      "from": "n011",
      "to": "n023",
      "relation": "synchronizes"
    },
    {
      "from": "n023",
      "to": "n012",
      "relation": "enables"
    },
    {
      "from": "n023",
      "to": "n016",
      "relation": "enables"
    },
    {
      "from": "n023",
      "to": "n019",
      "relation": "enables"
    },
    {
      "from": "n000",
      "to": "n001",
      "relation": "requires"
    },
    {
      "from": "n000",
      "to": "n004",
      "relation": "requires"
    },
    {
      "from": "n000",
      "to": "n009",
      "relation": "requires"
    },
    {
      "from": "n015",
      "to": "n024",
      "relation": "synchronizes"
    },
    {
      "from": "n018",
      "to": "n024",
      "relation": "synchronizes"
    },
    {
      "from": "n022",
      "to": "n024",
      "relation": "synchronizes"
    }
  ]
}
