{
  "format": "fwcollab.symbolic.state_dag.v1",
  "id": "DAG-L3-012",
  "difficulty": "L3",
  "evaluation_role": "scored",
  "visibility": "private_reference",
  "title": "固定反射机关球遮光门 × 可旋转反射光感门 × 可旋转反射箱子遮光门",
  "summary": "以nested拓扑组合3种元机关：固定反射机关球遮光门 × 可旋转反射光感门 × 可旋转反射箱子遮光门。",
  "topology_family": "nested",
  "mechanisms": [
    "M26",
    "M27",
    "M28"
  ],
  "nodes": [
    {
      "id": "n000",
      "kind": "condition",
      "owner": "team",
      "join": "all",
      "predicate": {
        "op": "start",
        "motif": "SYSTEM",
        "state": "task_ready",
        "phase": 0
      },
      "label": "任务初始状态成立"
    },
    {
      "id": "n001",
      "kind": "event",
      "owner": "agent_a",
      "join": "all",
      "predicate": {
        "op": "position",
        "motif": "M26",
        "state": "orb_reflection_state",
        "phase": 0
      },
      "label": "机关球对齐反射光路"
    },
    {
      "id": "n002",
      "kind": "state",
      "owner": "environment",
      "join": "all",
      "predicate": {
        "op": "route",
        "motif": "M26",
        "state": "fixed_reflection_desired",
        "phase": 0
      },
      "label": "固定反射光路达到目标状态"
    },
    {
      "id": "n003",
      "kind": "state",
      "owner": "environment",
      "join": "all",
      "predicate": {
        "op": "sense",
        "motif": "M26",
        "state": "sensor_desired",
        "phase": 0
      },
      "label": "反射传感器状态正确"
    },
    {
      "id": "n004",
      "kind": "state",
      "owner": "environment",
      "join": "all",
      "predicate": {
        "op": "activate",
        "motif": "M26",
        "state": "door_desired_state",
        "phase": 0
      },
      "label": "反射遮光门状态正确"
    },
    {
      "id": "n005",
      "kind": "event",
      "owner": "agent_b",
      "join": "all",
      "predicate": {
        "op": "traverse",
        "motif": "M26",
        "state": "partner_crossed_door",
        "phase": 0
      },
      "label": "搭档通过反射遮光门"
    },
    {
      "id": "n006",
      "kind": "event",
      "owner": "agent_b",
      "join": "all",
      "predicate": {
        "op": "toggle",
        "motif": "M27",
        "state": "mirror_toggle_desired",
        "phase": 1
      },
      "label": "镜面切换器状态正确"
    },
    {
      "id": "n007",
      "kind": "state",
      "owner": "environment",
      "join": "all",
      "predicate": {
        "op": "orient",
        "motif": "M27",
        "state": "mirror_oriented",
        "phase": 1
      },
      "label": "可旋转镜面对准"
    },
    {
      "id": "n008",
      "kind": "state",
      "owner": "environment",
      "join": "all",
      "predicate": {
        "op": "sense",
        "motif": "M27",
        "state": "sensor_lit",
        "phase": 1
      },
      "label": "旋转光路点亮传感器"
    },
    {
      "id": "n009",
      "kind": "state",
      "owner": "environment",
      "join": "all",
      "predicate": {
        "op": "activate",
        "motif": "M27",
        "state": "door_open",
        "phase": 1
      },
      "label": "旋镜光感门打开"
    },
    {
      "id": "n010",
      "kind": "event",
      "owner": "agent_a",
      "join": "all",
      "predicate": {
        "op": "traverse",
        "motif": "M27",
        "state": "partner_crossed_door",
        "phase": 1
      },
      "label": "搭档通过旋镜光感门"
    },
    {
      "id": "n011",
      "kind": "event",
      "owner": "agent_a",
      "join": "all",
      "predicate": {
        "op": "position",
        "motif": "M28",
        "state": "crate_beam_state",
        "phase": 2
      },
      "label": "箱子设置目标遮光状态"
    },
    {
      "id": "n012",
      "kind": "event",
      "owner": "agent_b",
      "join": "all",
      "predicate": {
        "op": "toggle",
        "motif": "M28",
        "state": "mirror_toggle_desired",
        "phase": 2
      },
      "label": "镜面切换器状态正确"
    },
    {
      "id": "n013",
      "kind": "state",
      "owner": "environment",
      "join": "all",
      "predicate": {
        "op": "orient",
        "motif": "M28",
        "state": "mirror_oriented",
        "phase": 2
      },
      "label": "可旋转镜面对准"
    },
    {
      "id": "n014",
      "kind": "state",
      "owner": "environment",
      "join": "all",
      "predicate": {
        "op": "sense",
        "motif": "M28",
        "state": "sensor_desired",
        "phase": 2
      },
      "label": "旋转传感器状态正确"
    },
    {
      "id": "n015",
      "kind": "state",
      "owner": "environment",
      "join": "all",
      "predicate": {
        "op": "activate",
        "motif": "M28",
        "state": "door_desired_state",
        "phase": 2
      },
      "label": "旋转遮光门状态正确"
    },
    {
      "id": "n016",
      "kind": "event",
      "owner": "team",
      "join": "all",
      "predicate": {
        "op": "traverse",
        "motif": "M28",
        "state": "team_crossed_door",
        "phase": 2
      },
      "label": "所需角色通过组合光门"
    },
    {
      "id": "n017",
      "kind": "goal",
      "owner": "team",
      "join": "all",
      "predicate": {
        "op": "team_success",
        "motif": "SYSTEM",
        "state": "all_required_goals",
        "phase": 4
      },
      "label": "双方满足团队成功条件"
    }
  ],
  "edges": [
    {
      "from": "n001",
      "to": "n002",
      "relation": "enables"
    },
    {
      "from": "n002",
      "to": "n003",
      "relation": "enables"
    },
    {
      "from": "n003",
      "to": "n004",
      "relation": "enables"
    },
    {
      "from": "n004",
      "to": "n005",
      "relation": "enables"
    },
    {
      "from": "n001",
      "to": "n005",
      "relation": "handoff"
    },
    {
      "from": "n006",
      "to": "n007",
      "relation": "enables"
    },
    {
      "from": "n007",
      "to": "n008",
      "relation": "enables"
    },
    {
      "from": "n008",
      "to": "n009",
      "relation": "enables"
    },
    {
      "from": "n009",
      "to": "n010",
      "relation": "enables"
    },
    {
      "from": "n006",
      "to": "n010",
      "relation": "handoff"
    },
    {
      "from": "n011",
      "to": "n012",
      "relation": "enables"
    },
    {
      "from": "n012",
      "to": "n013",
      "relation": "enables"
    },
    {
      "from": "n013",
      "to": "n014",
      "relation": "enables"
    },
    {
      "from": "n014",
      "to": "n015",
      "relation": "enables"
    },
    {
      "from": "n015",
      "to": "n016",
      "relation": "enables"
    },
    {
      "from": "n011",
      "to": "n016",
      "relation": "handoff"
    },
    {
      "from": "n005",
      "to": "n006",
      "relation": "requires"
    },
    {
      "from": "n010",
      "to": "n011",
      "relation": "requires"
    },
    {
      "from": "n000",
      "to": "n001",
      "relation": "requires"
    },
    {
      "from": "n016",
      "to": "n017",
      "relation": "synchronizes"
    }
  ]
}
