{
  "format": "fwcollab.symbolic.state_dag.v1",
  "id": "DAG-L4-011",
  "difficulty": "L4",
  "evaluation_role": "scored",
  "visibility": "private_reference",
  "title": "固定反射光感门 × 持久拨杆门 × 双角色专属出口",
  "summary": "以nested拓扑组合3种元机关：固定反射光感门 × 持久拨杆门 × 双角色专属出口。",
  "topology_family": "nested",
  "mechanisms": [
    "M24",
    "M17",
    "M10"
  ],
  "nodes": [
    {
      "id": "n000",
      "kind": "condition",
      "owner": "team",
      "join": "all",
      "predicate": {
        "op": "start",
        "motif": "SYSTEM",
        "state": "task_ready",
        "phase": 0
      },
      "label": "任务初始状态成立"
    },
    {
      "id": "n001",
      "kind": "condition",
      "owner": "environment",
      "join": "all",
      "predicate": {
        "op": "route",
        "motif": "M24",
        "state": "fixed_reflection_aligned",
        "phase": 0
      },
      "label": "固定镜面光路成立"
    },
    {
      "id": "n002",
      "kind": "state",
      "owner": "environment",
      "join": "all",
      "predicate": {
        "op": "sense",
        "motif": "M24",
        "state": "sensor_lit",
        "phase": 0
      },
      "label": "反射光点亮传感器"
    },
    {
      "id": "n003",
      "kind": "state",
      "owner": "environment",
      "join": "all",
      "predicate": {
        "op": "activate",
        "motif": "M24",
        "state": "door_open",
        "phase": 0
      },
      "label": "反射光感门打开"
    },
    {
      "id": "n004",
      "kind": "event",
      "owner": "agent_a",
      "join": "all",
      "predicate": {
        "op": "traverse",
        "motif": "M24",
        "state": "agent_crossed_door",
        "phase": 0
      },
      "label": "角色通过反射光感门"
    },
    {
      "id": "n005",
      "kind": "event",
      "owner": "agent_b",
      "join": "all",
      "predicate": {
        "op": "reach",
        "motif": "M17",
        "state": "lever_reached",
        "phase": 1
      },
      "label": "角色到达持久拨杆"
    },
    {
      "id": "n006",
      "kind": "state",
      "owner": "environment",
      "join": "all",
      "predicate": {
        "op": "latch",
        "motif": "M17",
        "state": "door_latched_open",
        "phase": 1
      },
      "label": "拨杆门永久打开"
    },
    {
      "id": "n007",
      "kind": "event",
      "owner": "agent_a",
      "join": "all",
      "predicate": {
        "op": "traverse",
        "motif": "M17",
        "state": "partner_crossed_door",
        "phase": 1
      },
      "label": "搭档通过拨杆门"
    },
    {
      "id": "n008",
      "kind": "goal",
      "owner": "team",
      "join": "all",
      "predicate": {
        "op": "goal",
        "motif": "M10",
        "state": "both_agents_at_exits",
        "phase": 2
      },
      "label": "双方到达各自专属出口"
    },
    {
      "id": "n009",
      "kind": "goal",
      "owner": "team",
      "join": "all",
      "predicate": {
        "op": "team_success",
        "motif": "SYSTEM",
        "state": "all_required_goals",
        "phase": 4
      },
      "label": "双方满足团队成功条件"
    }
  ],
  "edges": [
    {
      "from": "n001",
      "to": "n002",
      "relation": "enables"
    },
    {
      "from": "n002",
      "to": "n003",
      "relation": "enables"
    },
    {
      "from": "n003",
      "to": "n004",
      "relation": "enables"
    },
    {
      "from": "n005",
      "to": "n006",
      "relation": "enables"
    },
    {
      "from": "n006",
      "to": "n007",
      "relation": "enables"
    },
    {
      "from": "n005",
      "to": "n007",
      "relation": "handoff"
    },
    {
      "from": "n004",
      "to": "n005",
      "relation": "handoff"
    },
    {
      "from": "n007",
      "to": "n008",
      "relation": "requires"
    },
    {
      "from": "n000",
      "to": "n001",
      "relation": "requires"
    },
    {
      "from": "n008",
      "to": "n009",
      "relation": "synchronizes"
    }
  ]
}
