{
  "format": "fwcollab.symbolic.state_dag.v1",
  "id": "DAG-L3-001",
  "difficulty": "L3",
  "evaluation_role": "scored",
  "visibility": "private_reference",
  "title": "箱子压板桥 × 持久拨杆桥",
  "summary": "以nested拓扑组合2种元机关：箱子压板桥 × 持久拨杆桥。",
  "topology_family": "nested",
  "mechanisms": [
    "M15",
    "M18"
  ],
  "nodes": [
    {
      "id": "n000",
      "kind": "condition",
      "owner": "team",
      "join": "all",
      "predicate": {
        "op": "start",
        "motif": "SYSTEM",
        "state": "task_ready",
        "phase": 0
      },
      "label": "任务初始状态成立"
    },
    {
      "id": "n001",
      "kind": "event",
      "owner": "agent_a",
      "join": "all",
      "predicate": {
        "op": "position",
        "motif": "M15",
        "state": "crate_on_plate",
        "phase": 0
      },
      "label": "箱子到达桥压力板"
    },
    {
      "id": "n002",
      "kind": "state",
      "owner": "environment",
      "join": "all",
      "predicate": {
        "op": "activate",
        "motif": "M15",
        "state": "bridge_deployed",
        "phase": 0
      },
      "label": "箱子压力板桥展开"
    },
    {
      "id": "n003",
      "kind": "event",
      "owner": "team",
      "join": "all",
      "predicate": {
        "op": "traverse",
        "motif": "M15",
        "state": "team_crossed_bridge",
        "phase": 0
      },
      "label": "所需角色通过箱子桥"
    },
    {
      "id": "n004",
      "kind": "event",
      "owner": "agent_b",
      "join": "all",
      "predicate": {
        "op": "reach",
        "motif": "M18",
        "state": "lever_reached",
        "phase": 1
      },
      "label": "角色到达桥拨杆"
    },
    {
      "id": "n005",
      "kind": "state",
      "owner": "environment",
      "join": "all",
      "predicate": {
        "op": "latch",
        "motif": "M18",
        "state": "bridge_latched_open",
        "phase": 1
      },
      "label": "拨杆桥永久展开"
    },
    {
      "id": "n006",
      "kind": "event",
      "owner": "agent_a",
      "join": "all",
      "predicate": {
        "op": "traverse",
        "motif": "M18",
        "state": "partner_crossed_bridge",
        "phase": 1
      },
      "label": "搭档通过拨杆桥"
    },
    {
      "id": "n007",
      "kind": "goal",
      "owner": "team",
      "join": "all",
      "predicate": {
        "op": "team_success",
        "motif": "SYSTEM",
        "state": "all_required_goals",
        "phase": 3
      },
      "label": "双方满足团队成功条件"
    }
  ],
  "edges": [
    {
      "from": "n001",
      "to": "n002",
      "relation": "enables"
    },
    {
      "from": "n002",
      "to": "n003",
      "relation": "enables"
    },
    {
      "from": "n004",
      "to": "n005",
      "relation": "enables"
    },
    {
      "from": "n005",
      "to": "n006",
      "relation": "enables"
    },
    {
      "from": "n004",
      "to": "n006",
      "relation": "handoff"
    },
    {
      "from": "n003",
      "to": "n004",
      "relation": "requires"
    },
    {
      "from": "n000",
      "to": "n001",
      "relation": "requires"
    },
    {
      "from": "n006",
      "to": "n007",
      "relation": "synchronizes"
    }
  ]
}
