{
  "format": "fwcollab.symbolic.state_dag.v1",
  "id": "candidate-role-plate-door",
  "difficulty": "L2",
  "evaluation_role": "diagnostic",
  "visibility": "agent_candidate",
  "title": "角色压板门候选DAG",
  "summary": "一名角色保持压板，使搭档穿过门。",
  "topology_family": "hold_handoff",
  "mechanisms": ["M11"],
  "nodes": [
    {
      "id": "start",
      "kind": "condition",
      "owner": "team",
      "join": "all",
      "predicate": { "op": "start", "motif": "SYSTEM", "state": "task_ready", "phase": 0 },
      "label": "任务开始"
    },
    {
      "id": "hold",
      "kind": "condition",
      "owner": "agent_a",
      "join": "all",
      "predicate": { "op": "occupy", "motif": "M11", "state": "plate_held", "phase": 1 },
      "label": "角色A持续占据压力板"
    },
    {
      "id": "open",
      "kind": "state",
      "owner": "environment",
      "join": "all",
      "predicate": { "op": "activate", "motif": "M11", "state": "door_open", "phase": 1 },
      "label": "门保持打开"
    },
    {
      "id": "cross",
      "kind": "event",
      "owner": "agent_b",
      "join": "all",
      "predicate": { "op": "traverse", "motif": "M11", "state": "partner_crossed_door", "phase": 1 },
      "label": "角色B通过门"
    },
    {
      "id": "done",
      "kind": "goal",
      "owner": "team",
      "join": "all",
      "predicate": { "op": "team_success", "motif": "SYSTEM", "state": "all_required_goals", "phase": 2 },
      "label": "团队成功"
    }
  ],
  "edges": [
    { "from": "start", "to": "hold", "relation": "requires" },
    { "from": "hold", "to": "open", "relation": "enables" },
    { "from": "open", "to": "cross", "relation": "enables" },
    { "from": "hold", "to": "cross", "relation": "maintains" },
    { "from": "cross", "to": "done", "relation": "synchronizes" }
  ]
}
