{
  "format": "fwcollab.symbolic.state_dag.v1",
  "id": "DAG-V4-L2-005",
  "difficulty": "L2",
  "evaluation_role": "diagnostic",
  "visibility": "private_reference",
  "title": "constructive L2 controller curriculum 005",
  "summary": "DAG derived from concrete v3 controller wiring.",
  "topology_family": "constructive_controller_module",
  "mechanisms": [
    "M11",
    "M12",
    "M18"
  ],
  "nodes": [
    {
      "id": "n000",
      "kind": "condition",
      "owner": "team",
      "join": "all",
      "predicate": {
        "op": "start",
        "motif": "SYSTEM",
        "state": "task_ready",
        "phase": 0
      },
      "label": "start:task_ready"
    },
    {
      "id": "n001",
      "kind": "condition",
      "owner": "agent_a",
      "join": "all",
      "predicate": {
        "op": "occupy",
        "motif": "M11",
        "state": "c1_plate_on",
        "phase": 1
      },
      "label": "occupy:c1_plate_on"
    },
    {
      "id": "n002",
      "kind": "state",
      "owner": "environment",
      "join": "all",
      "predicate": {
        "op": "activate",
        "motif": "M11",
        "state": "a1_door_on",
        "phase": 2
      },
      "label": "activate:a1_door_on"
    },
    {
      "id": "n003",
      "kind": "event",
      "owner": "agent_b",
      "join": "all",
      "predicate": {
        "op": "traverse",
        "motif": "M11",
        "state": "a1_door_crossed",
        "phase": 3
      },
      "label": "traverse:a1_door_crossed"
    },
    {
      "id": "n004",
      "kind": "event",
      "owner": "agent_b",
      "join": "all",
      "predicate": {
        "op": "latch",
        "motif": "M18",
        "state": "c2_lever_on",
        "phase": 4
      },
      "label": "latch:c2_lever_on"
    },
    {
      "id": "n005",
      "kind": "state",
      "owner": "environment",
      "join": "all",
      "predicate": {
        "op": "activate",
        "motif": "M18",
        "state": "a2_platform_on",
        "phase": 5
      },
      "label": "activate:a2_platform_on"
    },
    {
      "id": "n006",
      "kind": "event",
      "owner": "agent_a",
      "join": "all",
      "predicate": {
        "op": "traverse",
        "motif": "M18",
        "state": "a2_platform_crossed",
        "phase": 6
      },
      "label": "traverse:a2_platform_crossed"
    },
    {
      "id": "n007",
      "kind": "goal",
      "owner": "team",
      "join": "all",
      "predicate": {
        "op": "team_success",
        "motif": "SYSTEM",
        "state": "all_required_goals",
        "phase": 7
      },
      "label": "team_success:all_required_goals"
    },
    {
      "id": "n008",
      "kind": "state",
      "owner": "environment",
      "join": "all",
      "predicate": {
        "op": "engage",
        "motif": "M12",
        "state": "m12_engaged",
        "phase": 8
      },
      "label": "engage:crate-held plate door"
    },
    {
      "id": "n009",
      "kind": "event",
      "owner": "agent_b",
      "join": "all",
      "predicate": {
        "op": "traverse",
        "motif": "M12",
        "state": "m12_crossed",
        "phase": 9
      },
      "label": "traverse:crate-held plate door"
    }
  ],
  "edges": [
    {
      "from": "n000",
      "to": "n001",
      "relation": "requires"
    },
    {
      "from": "n001",
      "to": "n002",
      "relation": "enables"
    },
    {
      "from": "n002",
      "to": "n003",
      "relation": "enables"
    },
    {
      "from": "n003",
      "to": "n004",
      "relation": "requires"
    },
    {
      "from": "n004",
      "to": "n005",
      "relation": "enables"
    },
    {
      "from": "n005",
      "to": "n006",
      "relation": "enables"
    },
    {
      "from": "n006",
      "to": "n008",
      "relation": "requires"
    },
    {
      "from": "n008",
      "to": "n009",
      "relation": "enables"
    },
    {
      "from": "n009",
      "to": "n007",
      "relation": "synchronizes"
    }
  ]
}
