{
  "format": "fwcollab.symbolic.state_dag.v1",
  "id": "DAG-L5-013",
  "difficulty": "L5",
  "evaluation_role": "scored",
  "visibility": "private_reference",
  "title": "单向通行 × 双角色专属出口 × 箱子压板门 × 角色压板桥",
  "summary": "以serial拓扑组合4种元机关：单向通行 × 双角色专属出口 × 箱子压板门 × 角色压板桥。",
  "topology_family": "serial",
  "mechanisms": [
    "M08",
    "M10",
    "M12",
    "M14"
  ],
  "nodes": [
    {
      "id": "n000",
      "kind": "condition",
      "owner": "team",
      "join": "all",
      "predicate": {
        "op": "start",
        "motif": "SYSTEM",
        "state": "task_ready",
        "phase": 0
      },
      "label": "任务初始状态成立"
    },
    {
      "id": "n001",
      "kind": "condition",
      "owner": "team",
      "join": "all",
      "predicate": {
        "op": "commit",
        "motif": "M08",
        "state": "return_resources_ready",
        "phase": 0
      },
      "label": "确认穿门前资源已就绪"
    },
    {
      "id": "n002",
      "kind": "event",
      "owner": "agent_a",
      "join": "all",
      "predicate": {
        "op": "traverse",
        "motif": "M08",
        "state": "oneway_crossed",
        "phase": 0
      },
      "label": "按允许方向通过单向门"
    },
    {
      "id": "n003",
      "kind": "goal",
      "owner": "team",
      "join": "all",
      "predicate": {
        "op": "goal",
        "motif": "M10",
        "state": "both_agents_at_exits",
        "phase": 1
      },
      "label": "双方到达各自专属出口"
    },
    {
      "id": "n004",
      "kind": "event",
      "owner": "agent_a",
      "join": "all",
      "predicate": {
        "op": "position",
        "motif": "M12",
        "state": "crate_on_plate",
        "phase": 2
      },
      "label": "箱子到达压力板"
    },
    {
      "id": "n005",
      "kind": "state",
      "owner": "environment",
      "join": "all",
      "predicate": {
        "op": "activate",
        "motif": "M12",
        "state": "door_open",
        "phase": 2
      },
      "label": "箱子压力板门打开"
    },
    {
      "id": "n006",
      "kind": "event",
      "owner": "team",
      "join": "all",
      "predicate": {
        "op": "traverse",
        "motif": "M12",
        "state": "team_crossed_door",
        "phase": 2
      },
      "label": "所需角色通过箱子门"
    },
    {
      "id": "n007",
      "kind": "condition",
      "owner": "agent_b",
      "join": "all",
      "predicate": {
        "op": "occupy",
        "motif": "M14",
        "state": "plate_held",
        "phase": 3
      },
      "label": "角色持续占据桥压力板"
    },
    {
      "id": "n008",
      "kind": "state",
      "owner": "environment",
      "join": "all",
      "predicate": {
        "op": "activate",
        "motif": "M14",
        "state": "bridge_deployed",
        "phase": 3
      },
      "label": "压力板桥保持展开"
    },
    {
      "id": "n009",
      "kind": "event",
      "owner": "agent_a",
      "join": "all",
      "predicate": {
        "op": "traverse",
        "motif": "M14",
        "state": "partner_crossed_bridge",
        "phase": 3
      },
      "label": "搭档通过压力板桥"
    },
    {
      "id": "n010",
      "kind": "goal",
      "owner": "team",
      "join": "all",
      "predicate": {
        "op": "team_success",
        "motif": "SYSTEM",
        "state": "all_required_goals",
        "phase": 5
      },
      "label": "双方满足团队成功条件"
    }
  ],
  "edges": [
    {
      "from": "n001",
      "to": "n002",
      "relation": "enables"
    },
    {
      "from": "n004",
      "to": "n005",
      "relation": "enables"
    },
    {
      "from": "n005",
      "to": "n006",
      "relation": "enables"
    },
    {
      "from": "n007",
      "to": "n008",
      "relation": "enables"
    },
    {
      "from": "n008",
      "to": "n009",
      "relation": "enables"
    },
    {
      "from": "n007",
      "to": "n009",
      "relation": "maintains"
    },
    {
      "from": "n002",
      "to": "n003",
      "relation": "requires"
    },
    {
      "from": "n003",
      "to": "n004",
      "relation": "requires"
    },
    {
      "from": "n006",
      "to": "n007",
      "relation": "requires"
    },
    {
      "from": "n000",
      "to": "n001",
      "relation": "requires"
    },
    {
      "from": "n009",
      "to": "n010",
      "relation": "synchronizes"
    }
  ]
}
