{
  "format": "fwcollab.symbolic.state_dag.v1",
  "id": "DAG-L4-010",
  "difficulty": "L4",
  "evaluation_role": "scored",
  "visibility": "private_reference",
  "title": "机关球遮光门 × 角色压板桥 × 通用危险地形 × 固定反射光感门 × 箱子压板桥",
  "summary": "以two_wave拓扑组合5种元机关：机关球遮光门 × 角色压板桥 × 通用危险地形 × 固定反射光感门 × 箱子压板桥。",
  "topology_family": "two_wave",
  "mechanisms": [
    "M23",
    "M14",
    "M05",
    "M24",
    "M15"
  ],
  "nodes": [
    {
      "id": "n000",
      "kind": "condition",
      "owner": "team",
      "join": "all",
      "predicate": {
        "op": "start",
        "motif": "SYSTEM",
        "state": "task_ready",
        "phase": 0
      },
      "label": "任务初始状态成立"
    },
    {
      "id": "n001",
      "kind": "event",
      "owner": "agent_a",
      "join": "all",
      "predicate": {
        "op": "position",
        "motif": "M23",
        "state": "orb_beam_state",
        "phase": 0
      },
      "label": "机关球停在目标遮光位置"
    },
    {
      "id": "n002",
      "kind": "state",
      "owner": "environment",
      "join": "all",
      "predicate": {
        "op": "sense",
        "motif": "M23",
        "state": "sensor_desired",
        "phase": 0
      },
      "label": "传感器达到目标状态"
    },
    {
      "id": "n003",
      "kind": "state",
      "owner": "environment",
      "join": "all",
      "predicate": {
        "op": "activate",
        "motif": "M23",
        "state": "door_desired_state",
        "phase": 0
      },
      "label": "遮光门状态正确"
    },
    {
      "id": "n004",
      "kind": "event",
      "owner": "agent_b",
      "join": "all",
      "predicate": {
        "op": "traverse",
        "motif": "M23",
        "state": "partner_crossed_door",
        "phase": 0
      },
      "label": "搭档通过遮光门"
    },
    {
      "id": "n005",
      "kind": "condition",
      "owner": "agent_b",
      "join": "all",
      "predicate": {
        "op": "occupy",
        "motif": "M14",
        "state": "plate_held",
        "phase": 1
      },
      "label": "角色持续占据桥压力板"
    },
    {
      "id": "n006",
      "kind": "state",
      "owner": "environment",
      "join": "all",
      "predicate": {
        "op": "activate",
        "motif": "M14",
        "state": "bridge_deployed",
        "phase": 1
      },
      "label": "压力板桥保持展开"
    },
    {
      "id": "n007",
      "kind": "event",
      "owner": "agent_a",
      "join": "all",
      "predicate": {
        "op": "traverse",
        "motif": "M14",
        "state": "partner_crossed_bridge",
        "phase": 1
      },
      "label": "搭档通过压力板桥"
    },
    {
      "id": "n008",
      "kind": "condition",
      "owner": "team",
      "join": "all",
      "predicate": {
        "op": "plan",
        "motif": "M05",
        "state": "hazard_route_safe",
        "phase": 2
      },
      "label": "确认危险区绕行路线"
    },
    {
      "id": "n009",
      "kind": "event",
      "owner": "team",
      "join": "all",
      "predicate": {
        "op": "traverse",
        "motif": "M05",
        "state": "hazard_avoided",
        "phase": 2
      },
      "label": "双方避开危险区"
    },
    {
      "id": "n010",
      "kind": "condition",
      "owner": "environment",
      "join": "all",
      "predicate": {
        "op": "route",
        "motif": "M24",
        "state": "fixed_reflection_aligned",
        "phase": 3
      },
      "label": "固定镜面光路成立"
    },
    {
      "id": "n011",
      "kind": "state",
      "owner": "environment",
      "join": "all",
      "predicate": {
        "op": "sense",
        "motif": "M24",
        "state": "sensor_lit",
        "phase": 3
      },
      "label": "反射光点亮传感器"
    },
    {
      "id": "n012",
      "kind": "state",
      "owner": "environment",
      "join": "all",
      "predicate": {
        "op": "activate",
        "motif": "M24",
        "state": "door_open",
        "phase": 3
      },
      "label": "反射光感门打开"
    },
    {
      "id": "n013",
      "kind": "event",
      "owner": "agent_b",
      "join": "all",
      "predicate": {
        "op": "traverse",
        "motif": "M24",
        "state": "agent_crossed_door",
        "phase": 3
      },
      "label": "角色通过反射光感门"
    },
    {
      "id": "n014",
      "kind": "event",
      "owner": "agent_a",
      "join": "all",
      "predicate": {
        "op": "position",
        "motif": "M15",
        "state": "crate_on_plate",
        "phase": 4
      },
      "label": "箱子到达桥压力板"
    },
    {
      "id": "n015",
      "kind": "state",
      "owner": "environment",
      "join": "all",
      "predicate": {
        "op": "activate",
        "motif": "M15",
        "state": "bridge_deployed",
        "phase": 4
      },
      "label": "箱子压力板桥展开"
    },
    {
      "id": "n016",
      "kind": "event",
      "owner": "team",
      "join": "all",
      "predicate": {
        "op": "traverse",
        "motif": "M15",
        "state": "team_crossed_bridge",
        "phase": 4
      },
      "label": "所需角色通过箱子桥"
    },
    {
      "id": "n017",
      "kind": "state",
      "owner": "team",
      "join": "all",
      "predicate": {
        "op": "synchronize",
        "motif": "SYSTEM",
        "state": "wave_one",
        "phase": 5
      },
      "label": "第一批并行子目标完成"
    },
    {
      "id": "n018",
      "kind": "goal",
      "owner": "team",
      "join": "all",
      "predicate": {
        "op": "team_success",
        "motif": "SYSTEM",
        "state": "all_required_goals",
        "phase": 6
      },
      "label": "双方满足团队成功条件"
    }
  ],
  "edges": [
    {
      "from": "n001",
      "to": "n002",
      "relation": "enables"
    },
    {
      "from": "n002",
      "to": "n003",
      "relation": "enables"
    },
    {
      "from": "n003",
      "to": "n004",
      "relation": "enables"
    },
    {
      "from": "n001",
      "to": "n004",
      "relation": "handoff"
    },
    {
      "from": "n005",
      "to": "n006",
      "relation": "enables"
    },
    {
      "from": "n006",
      "to": "n007",
      "relation": "enables"
    },
    {
      "from": "n005",
      "to": "n007",
      "relation": "maintains"
    },
    {
      "from": "n008",
      "to": "n009",
      "relation": "enables"
    },
    {
      "from": "n010",
      "to": "n011",
      "relation": "enables"
    },
    {
      "from": "n011",
      "to": "n012",
      "relation": "enables"
    },
    {
      "from": "n012",
      "to": "n013",
      "relation": "enables"
    },
    {
      "from": "n014",
      "to": "n015",
      "relation": "enables"
    },
    {
      "from": "n015",
      "to": "n016",
      "relation": "enables"
    },
    {
      "from": "n004",
      "to": "n017",
      "relation": "synchronizes"
    },
    {
      "from": "n007",
      "to": "n017",
      "relation": "synchronizes"
    },
    {
      "from": "n017",
      "to": "n008",
      "relation": "enables"
    },
    {
      "from": "n017",
      "to": "n010",
      "relation": "enables"
    },
    {
      "from": "n017",
      "to": "n014",
      "relation": "enables"
    },
    {
      "from": "n000",
      "to": "n001",
      "relation": "requires"
    },
    {
      "from": "n000",
      "to": "n005",
      "relation": "requires"
    },
    {
      "from": "n009",
      "to": "n018",
      "relation": "synchronizes"
    },
    {
      "from": "n013",
      "to": "n018",
      "relation": "synchronizes"
    },
    {
      "from": "n016",
      "to": "n018",
      "relation": "synchronizes"
    }
  ]
}
